{
  "availability": {
    "delivery": true,
    "pickup": true
  },
  "dayParts": [],
  "description": {
    "en": "example",
    "fr": "example"
  },
  "displayGroup": "example",
  "id": "500123",
  "image": {
    "altText": {},
    "resource": "example"
  },
  "name": {
    "en": "example",
    "fr": "example"
  },
  "nutrition": {
    "allergens": {},
    "calories": {},
    "nutrients": {}
  },
  "options": {
    "defaults": [],
    "entries": [
      {}
    ],
    "injectDefault": true,
    "quantity": {}
  },
  "price": {
    "delivery": 1.0,
    "pickup": 1.0
  },
  "productType": [],
  "quantity": {
    "def": 1,
    "max": 1,
    "min": 1
  },
  "type": "ITEM"
}